{
  "schema_version": 1,
  "id": "examples/small-multiples",
  "title": "Revenue by region, one panel each",
  "description": "Small multiples: the same line chart once per region, on a shared scale. Use instead of a crowded multi-line chart.",
  "tags": [
    "examples",
    "sample"
  ],
  "author": "sample@example.com",
  "created_at": "2026-09-22T10:00:00Z",
  "updated_at": "2026-09-22T10:00:00Z",
  "renderer": "vega-lite",
  "spec": {
    "$schema": "https://vega.github.io/schema/vega-lite/v6.json",
    "data": {
      "name": "data"
    },
    "width": 200,
    "height": 80,
    "autosize": {
      "type": "pad",
      "resize": true
    },
    "mark": "line",
    "encoding": {
      "facet": {
        "field": "region",
        "type": "nominal",
        "columns": 2,
        "title": null
      },
      "x": {
        "field": "month",
        "timeUnit": "utcyearmonth",
        "type": "temporal",
        "title": null
      },
      "y": {
        "field": "revenue",
        "aggregate": "sum",
        "type": "quantitative",
        "title": null,
        "axis": {
          "format": "$.2s"
        }
      },
      "tooltip": [
        {
          "field": "month",
          "timeUnit": "utcyearmonth",
          "type": "temporal",
          "title": "Month"
        },
        {
          "field": "revenue",
          "aggregate": "sum",
          "type": "quantitative",
          "title": "Revenue",
          "format": "$,.0f"
        }
      ]
    }
  },
  "data": {
    "format": "json",
    "lane": "small",
    "rows": 144,
    "bytes": 14756,
    "columns": [
      {
        "name": "month",
        "type": "date"
      },
      {
        "name": "region",
        "type": "string"
      },
      {
        "name": "revenue",
        "type": "number"
      },
      {
        "name": "orders",
        "type": "integer"
      }
    ]
  },
  "aggregate": null
}
