{
  "schema_version": 1,
  "id": "examples/heatmap",
  "title": "Average revenue by month of year and region",
  "description": "Heatmap. Use for one measure across two categories, for example seasonality by region.",
  "tags": [
    "examples",
    "sample"
  ],
  "author": "sample@example.com",
  "created_at": "2026-09-22T10:00:00Z",
  "updated_at": "2026-09-22T10:00:00Z",
  "renderer": "vega-lite",
  "spec": {
    "$schema": "https://vega.github.io/schema/vega-lite/v6.json",
    "data": {
      "name": "data"
    },
    "mark": "rect",
    "encoding": {
      "x": {
        "field": "month",
        "timeUnit": "utcmonth",
        "type": "ordinal",
        "title": "Month"
      },
      "y": {
        "field": "region",
        "type": "nominal",
        "title": "Region"
      },
      "color": {
        "field": "revenue",
        "aggregate": "mean",
        "type": "quantitative",
        "title": "Avg revenue",
        "scale": {
          "scheme": "blues"
        },
        "legend": {
          "format": "$.2s"
        }
      },
      "tooltip": [
        {
          "field": "month",
          "timeUnit": "utcmonth",
          "type": "ordinal",
          "title": "Month"
        },
        {
          "field": "region",
          "type": "nominal",
          "title": "Region"
        },
        {
          "field": "revenue",
          "aggregate": "mean",
          "type": "quantitative",
          "title": "Avg revenue",
          "format": "$,.0f"
        }
      ]
    }
  },
  "data": {
    "format": "json",
    "lane": "small",
    "rows": 144,
    "bytes": 14756,
    "columns": [
      {
        "name": "month",
        "type": "date"
      },
      {
        "name": "region",
        "type": "string"
      },
      {
        "name": "revenue",
        "type": "number"
      },
      {
        "name": "orders",
        "type": "integer"
      }
    ]
  },
  "aggregate": null
}
