{
  "schema_version": 1,
  "id": "bakeoff/echarts/grouped-bar",
  "title": "Orders by region, quarterly (ECharts)",
  "description": "Quarterly orders per region. Filter with the Region control.",
  "tags": [
    "bakeoff",
    "sample"
  ],
  "author": "sample@example.com",
  "created_at": "2026-09-22T10:00:00Z",
  "updated_at": "2026-09-22T10:00:00Z",
  "renderer": "echarts",
  "spec": {
    "xAxis": {
      "type": "category",
      "name": "Quarter"
    },
    "yAxis": {
      "type": "value",
      "name": "Orders"
    },
    "legend": {},
    "tooltip": {
      "trigger": "axis",
      "renderMode": "richText"
    },
    "series": [
      {
        "type": "bar",
        "split": "region",
        "encode": {
          "x": "quarter",
          "y": "orders"
        }
      }
    ]
  },
  "data": {
    "format": "json",
    "lane": "small",
    "rows": 48,
    "bytes": 3645,
    "columns": [
      {
        "name": "quarter",
        "type": "string"
      },
      {
        "name": "region",
        "type": "string"
      },
      {
        "name": "orders",
        "type": "integer"
      }
    ]
  },
  "aggregate": null
}
